time,decision_mode,window_start,window_end,current_ti_C,current_tsp_C,mean_abs_error_C,mean_error_C,max_abs_error_C,power_mean_W,power_std_W,last_power_W,energy_kWh,error_sign_changes,Ta_now_C,Ta_future_C,Ta_mean_future_C,Ta_delta_next_1h_C,next_habit_label,next_habit_type,minutes_to_next_habit,kp_before,ki_before,kd_before,setpoint_before_C,comfort_weight_before,energy_weight_before,response_weight_before,weighted_cost_before,action,decision_source,reason,rationale,kp_after,ki_after,kd_after,setpoint_after_C,comfort_weight_after,energy_weight_after,response_weight_after,weighted_cost_after
2026-04-02 00:10:00,proactive,2026-04-02 00:05:00,2026-04-02 00:09:00,25.708184999705722,39.0,14.318565352051113,14.318565352051113,15.365132472068808,14.16912812506131,0.16174374987738388,13.84564062530654,0.0011807606770884423,0,20.81,20.2,20.700000000000003,-0.6099999999999994,none,none,-1,1.0,2.5,0.0,39.0,0.34,0.33,0.33,69.71118569687086,set_cost_weights,agent,"Forecast shows a significant temperature increase in the evening, raising energy cost weight to prepare for higher tariffs during on-peak hours.","Forecast shows a significant temperature increase in the evening, raising energy cost weight to prepare for higher tariffs during on-peak hours.",1.0,2.5,0.0,39.0,0.35,0.35,0.3,71.76163112144216
2026-04-02 00:20:00,proactive,2026-04-02 00:15:00,2026-04-02 00:19:00,30.138735755452807,39.0,9.689698681884845,9.689698681884845,10.53576979760788,13.966228258868682,0.034334661707401196,13.910381562155372,0.0011638523549057235,0,20.81,20.2,20.6,-0.6099999999999994,none,none,-1,1.0,2.5,0.0,39.0,0.35,0.35,0.3,32.865666415879204,set_cost_weights,agent,"Forecast suggests a warm day ahead, raising comfort weight to prepare for higher temperatures and evening cooler preference. Tariff schedule indicates on-peak hours during the evening, so energy weight is slightly reduced.","Forecast suggests a warm day ahead, raising comfort weight to prepare for higher temperatures and evening cooler preference. Tariff schedule indicates on-peak hours during the evening, so energy weight is slightly reduced.",1.0,2.5,0.0,39.0,0.4,0.35,0.25,37.56017915289279
2026-04-02 00:30:00,proactive,2026-04-02 00:25:00,2026-04-02 00:29:00,33.673901552394,39.0,5.9662241150503075,5.9662241150503075,6.625533127053757,13.39450029863429,0.11766435116982142,13.224488583999284,0.0011162083582195244,0,20.81,20.2,20.500000000000004,-0.6099999999999994,none,none,-1,1.0,2.5,0.0,39.0,0.4,0.35,0.25,14.242255850777907,set_cost_weights,agent,"Forecast shows a significant temperature increase in the evening, raising comfort weight to prepare for higher outdoor temperatures. Tariff schedule indicates on-peak hours during this period, further increasing energy cost weight.","Forecast shows a significant temperature increase in the evening, raising comfort weight to prepare for higher outdoor temperatures. Tariff schedule indicates on-peak hours during this period, further increasing energy cost weight.",1.0,2.5,0.0,39.0,0.5,0.3,0.2,17.801277356675374
2026-04-02 00:40:00,proactive,2026-04-02 00:35:00,2026-04-02 00:39:00,36.26791971665015,39.0,3.187706006638865,3.187706006638865,3.6608538730028215,12.43325958663253,0.14753759179250148,12.223927684079129,0.0010361049655527109,0,20.81,20.2,20.400000000000006,-0.6099999999999994,none,none,-1,1.0,2.5,0.0,39.0,0.5,0.3,0.2,5.0838645463328636,set_cost_weights,agent,"Increased comfort weight due to upcoming cooler preference at night and evening high temperature demand, while maintaining a balance with energy savings.","Increased comfort weight due to upcoming cooler preference at night and evening high temperature demand, while maintaining a balance with energy savings.",1.0,2.5,0.0,39.0,0.6,0.35,0.05,6.100513478000198
2026-04-02 00:50:00,proactive,2026-04-02 00:45:00,2026-04-02 00:49:00,38.01849215068718,39.0,1.278662006462548,1.278662006462548,1.5901672973637417,11.387407515914408,0.14445591363042326,11.184129585095363,0.0009489506263262005,0,20.81,20.2,20.300000000000004,-0.6099999999999994,none,none,-1,1.0,2.5,0.0,39.0,0.6,0.35,0.05,0.9843123814537116,set_cost_weights,agent,"Forecast shows a significant temperature increase in the evening, raising comfort weight to prepare for higher indoor temperatures. Tariff schedule indicates on-peak hours during this period, further increasing energy cost weight.","Forecast shows a significant temperature increase in the evening, raising comfort weight to prepare for higher indoor temperatures. Tariff schedule indicates on-peak hours during this period, further increasing energy cost weight.",1.0,2.5,0.0,39.0,0.7,0.25,0.05,1.1468610835044681
2026-04-02 01:00:00,proactive,2026-04-02 00:55:00,2026-04-02 00:59:00,39.07688362439986,39.0,0.05390833588398607,0.05390833588398607,0.26954167941993035,10.39349734404379,0.10781667176797215,10.339589008159805,0.000866124778670316,0,20.2,20.0,20.196721311475414,-0.1999999999999993,night_cooler_preference,cooler,60,1.0,2.5,0.0,39.0,0.7,0.25,0.05,0.0042024503011373025,set_cost_weights,agent,"Forecast suggests cooler temperatures and upcoming on-peak hours, raising comfort weight to prepare for evening high temperature demand.","Forecast suggests cooler temperatures and upcoming on-peak hours, raising comfort weight to prepare for evening high temperature demand.",1.0,2.5,0.0,39.0,0.8,0.15,0.05,0.0036269363902450523
2026-04-02 01:10:00,proactive,2026-04-02 01:05:00,2026-04-02 01:09:00,39.56481369175435,39.0,0.49363560890211744,-0.49363560890211744,0.5648136917543525,9.73846115306725,0.08282085359884722,9.62304962251896,0.0008115384294222708,0,20.2,20.0,20.16393442622951,-0.1999999999999993,night_cooler_preference,cooler,50,1.0,2.5,0.0,39.0,0.8,0.15,0.05,0.19615988810629373,set_cost_weights,agent,"Forecast suggests cooler temperatures and upcoming on-peak hours, raising comfort weight to prepare for evening high temperature demand.","Forecast suggests cooler temperatures and upcoming on-peak hours, raising comfort weight to prepare for evening high temperature demand.",1.0,2.5,0.0,39.0,0.85,0.1,0.05,0.20793792461039076
2026-04-02 01:20:00,proactive,2026-04-02 01:15:00,2026-04-02 01:19:00,39.74858948477249,39.0,0.7275918431881706,-0.7275918431881706,0.7485894847724879,9.236393978350304,0.059515677351639144,9.153806274587266,0.0007696994981958586,0,20.2,20.0,20.131147540983605,-0.1999999999999993,night_cooler_preference,cooler,40,1.0,2.5,0.0,39.0,0.85,0.1,0.05,0.45075197840486275,set_cost_weights,agent,"Forecast suggests cooler temperatures and upcoming on-peak hours, raising comfort weight to prepare for evening high temperature demand.","Forecast suggests cooler temperatures and upcoming on-peak hours, raising comfort weight to prepare for evening high temperature demand.",1.0,2.5,0.0,39.0,0.8571428571428571,0.09523809523809523,0.047619047619047616,0.45449664087481967
2026-04-02 01:30:00,proactive,2026-04-02 01:25:00,2026-04-02 01:29:00,39.75016019676136,39.0,0.7588868187868598,-0.7588868187868598,0.7654000409342316,8.889514619213037,0.039244249465466896,8.835318797987773,0.0007407928849344198,0,20.2,20.0,20.098360655737704,-0.1999999999999993,night_cooler_preference,cooler,30,1.0,2.5,0.0,39.0,0.8571428571428571,0.09523809523809523,0.047619047619047616,0.4943423385347512,set_cost_weights,agent,Prepared for cooler preference at night and higher energy cost during on-peak hours.,Prepared for cooler preference at night and higher energy cost during on-peak hours.,1.0,2.5,0.0,39.0,0.8571428571428571,0.09523809523809523,0.047619047619047616,0.4943423385347512
2026-04-02 01:40:00,proactive,2026-04-02 01:35:00,2026-04-02 01:39:00,39.65350721118062,39.0,0.6770901858592537,-0.6770901858592537,0.699709543748881,8.67120427776172,0.023239568282717636,8.639326038298904,0.0007226003564801434,0,20.2,20.0,20.065573770491802,-0.1999999999999993,night_cooler_preference,cooler,20,1.0,2.5,0.0,39.0,0.8571428571428571,0.09523809523809523,0.047619047619047616,0.3936464201407496,set_cost_weights,agent,"Prepared for cooler preference at night and high temperature demand in the evening by raising comfort weight, while keeping energy and response weights low to balance cost.","Prepared for cooler preference at night and high temperature demand in the evening by raising comfort weight, while keeping energy and response weights low to balance cost.",1.0,2.5,0.0,39.0,0.9,0.05,0.05,0.41296744096954713
2026-04-02 01:50:00,proactive,2026-04-02 01:45:00,2026-04-02 01:49:00,39.51657547504761,39.0,0.5450855463801048,-0.5450855463801048,0.573429578538807,8.550432976202568,0.011610914724377152,8.534703965067727,0.0007125360813502139,0,20.2,20.0,20.0327868852459,-0.1999999999999993,night_cooler_preference,cooler,10,1.0,2.5,0.0,39.0,0.9,0.05,0.05,0.2677627288209589,set_cost_weights,agent,Prepared for cooler preference and higher energy costs during on-peak hours.,Prepared for cooler preference and higher energy costs during on-peak hours.,1.0,2.5,0.0,39.0,0.9,0.05,0.05,0.2677627288209589
2026-04-02 02:00:00,proactive,2026-04-02 01:55:00,2026-04-02 01:59:00,39.375772223832065,39.0,0.4032274491567975,-0.4032274491567975,0.43096728241684445,8.49783063782844,0.0038510984801572814,8.492833602769656,0.0007081525531523699,0,20.0,20.0,20.0,0.0,night_cooler_preference,cooler,0,1.0,2.5,0.0,39.0,0.9,0.05,0.05,0.14668721810654547,set_cost_weights,agent,"Forecast suggests cooler temperatures ahead, and the next schedule event is a night cooler preference at 2 AM. Raising comfort weight to prepare for cooler conditions.","Forecast suggests cooler temperatures ahead, and the next schedule event is a night cooler preference at 2 AM. Raising comfort weight to prepare for cooler conditions.",1.0,2.5,0.0,39.0,0.9,0.05,0.05,0.14668721810654547
2026-04-02 02:10:00,proactive,2026-04-02 02:05:00,2026-04-02 02:09:00,39.22291454856898,39.0,0.2505046685247251,-0.2505046685247251,0.27894588839017587,8.517730094019939,0.005471623056968224,8.52561213118478,0.0007098108411683283,0,20.0,20.0,20.0,0.0,none,none,-1,1.0,2.5,0.0,39.0,0.9,0.05,0.05,0.05683224284978259,set_cost_weights,agent,"Evening temperatures are expected to rise, and the next on-peak period is approaching. Increasing comfort weight prepares for higher indoor setpoint adjustments needed later.","Evening temperatures are expected to rise, and the next on-peak period is approaching. Increasing comfort weight prepares for higher indoor setpoint adjustments needed later.",1.0,2.5,0.0,39.0,0.9,0.05,0.05,0.05683224284978259
2026-04-02 02:20:00,proactive,2026-04-02 02:15:00,2026-04-02 02:19:00,39.17011525639995,39.0,0.0,0.0,0.0,8.739778117728525,0.0,8.739778117728525,0.0007283148431440438,0,20.0,20.0,20.0,0.0,none,none,-1,1.0,2.5,0.0,39.0,0.9,0.05,0.05,0.00036415742157202196,set_cost_weights,agent,Increased comfort weight to prepare for evening high temperature demand and improved stability preference.,Increased comfort weight to prepare for evening high temperature demand and improved stability preference.,1.0,2.5,0.0,39.0,0.9,0.05,0.05,0.00036415742157202196
2026-04-02 02:30:00,proactive,2026-04-02 02:25:00,2026-04-02 02:29:00,39.14134837331079,39.0,0.0,0.0,0.0,8.739778117728525,0.0,8.739778117728525,0.0007283148431440438,0,20.0,20.0,20.0,0.0,none,none,-1,1.0,2.5,0.0,39.0,0.9,0.05,0.05,0.00036415742157202196,set_cost_weights,agent,Prepared for the evening temperature rise and on-peak tariff period by slightly raising comfort weight.,Prepared for the evening temperature rise and on-peak tariff period by slightly raising comfort weight.,1.0,2.5,0.0,39.0,0.9,0.05,0.05,0.00036415742157202196
2026-04-02 02:40:00,proactive,2026-04-02 02:35:00,2026-04-02 02:39:00,39.11758738619932,39.0,0.0,0.0,0.0,8.739778117728525,0.0,8.739778117728525,0.0007283148431440438,0,20.0,20.0,20.0,0.0,none,none,-1,1.0,2.5,0.0,39.0,0.9,0.05,0.05,0.00036415742157202196,set_cost_weights,agent,"Evening temperatures are expected to rise, and the next on-peak period is approaching. Increasing comfort weight prepares for higher evening temperatures while slightly raising energy cost sensitivity.","Evening temperatures are expected to rise, and the next on-peak period is approaching. Increasing comfort weight prepares for higher evening temperatures while slightly raising energy cost sensitivity.",1.0,2.5,0.0,39.0,0.9,0.05,0.05,0.00036415742157202196
2026-04-02 02:50:00,proactive,2026-04-02 02:45:00,2026-04-02 02:49:00,39.09796118941039,39.0,0.0,0.0,0.0,8.739778117728525,0.0,8.739778117728525,0.0007283148431440438,0,20.0,20.0,20.0,0.0,none,none,-1,1.0,2.5,0.0,39.0,0.9,0.05,0.05,0.00036415742157202196,set_cost_weights,agent,Raising comfort weight to prepare for evening high temperature demand and improving sleep stability.,Raising comfort weight to prepare for evening high temperature demand and improving sleep stability.,1.0,2.5,0.0,39.0,0.9,0.05,0.05,0.00036415742157202196
2026-04-02 03:00:00,proactive,2026-04-02 02:55:00,2026-04-02 02:59:00,39.081750263551505,39.0,0.0,0.0,0.0,8.739778117728525,0.0,8.739778117728525,0.0007283148431440438,0,20.0,14.0,19.901639344262296,-6.0,none,none,-1,1.0,2.5,0.0,39.0,0.9,0.05,0.05,0.00036415742157202196,set_cost_weights,agent,Prepared for the upcoming on-peak period and evening high temperature demand by slightly raising comfort weight.,Prepared for the upcoming on-peak period and evening high temperature demand by slightly raising comfort weight.,1.0,2.5,0.0,39.0,0.9,0.05,0.05,0.00036415742157202196
2026-04-02 03:10:00,proactive,2026-04-02 03:05:00,2026-04-02 03:09:00,39.068360297068054,39.0,0.0,0.0,0.0,8.739778117728525,0.0,8.739778117728525,0.0007283148431440438,0,20.0,14.0,18.918032786885245,-6.0,none,none,-1,1.0,2.5,0.0,39.0,0.9,0.05,0.05,0.00036415742157202196,set_cost_weights,agent,Prepare for the upcoming on-peak period and evening high temperature demand by slightly raising energy cost weight.,Prepare for the upcoming on-peak period and evening high temperature demand by slightly raising energy cost weight.,1.0,2.5,0.0,39.0,0.9,0.05,0.05,0.00036415742157202196
2026-04-02 03:20:00,proactive,2026-04-02 03:15:00,2026-04-02 03:19:00,39.05730039808455,39.0,0.0,0.0,0.0,8.739778117728525,0.0,8.739778117728525,0.0007283148431440438,0,20.0,14.0,17.934426229508198,-6.0,none,none,-1,1.0,2.5,0.0,39.0,0.9,0.05,0.05,0.00036415742157202196,set_cost_weights,agent,"Prepared for evening temperature rise and on-peak tariff, slightly increasing comfort weight.","Prepared for evening temperature rise and on-peak tariff, slightly increasing comfort weight.",1.0,2.5,0.0,39.0,0.9,0.05,0.05,0.00036415742157202196
2026-04-02 03:30:00,proactive,2026-04-02 03:25:00,2026-04-02 03:29:00,39.048165097732856,39.0,0.0,0.0,0.0,8.739778117728525,0.0,8.739778117728525,0.0007283148431440438,0,20.0,14.0,16.950819672131146,-6.0,none,none,-1,1.0,2.5,0.0,39.0,0.9,0.05,0.05,0.00036415742157202196,set_cost_weights,agent,Prepare for the upcoming on-peak period and evening high temperature demand by slightly raising comfort weight.,Prepare for the upcoming on-peak period and evening high temperature demand by slightly raising comfort weight.,1.0,2.5,0.0,39.0,0.9,0.05,0.05,0.00036415742157202196
2026-04-02 03:40:00,proactive,2026-04-02 03:35:00,2026-04-02 03:39:00,39.04061948518793,39.0,0.0,0.0,0.0,8.739778117728525,0.0,8.739778117728525,0.0007283148431440438,0,20.0,14.0,15.967213114754099,-6.0,none,none,-1,1.0,2.5,0.0,39.0,0.9,0.05,0.05,0.00036415742157202196,set_cost_weights,agent,"Prepared for evening temperature rise and on-peak tariff, slightly raising comfort weight.","Prepared for evening temperature rise and on-peak tariff, slightly raising comfort weight.",1.0,2.5,0.0,39.0,0.9,0.05,0.05,0.00036415742157202196
2026-04-02 03:50:00,proactive,2026-04-02 03:45:00,2026-04-02 03:49:00,39.03438692944415,39.0,0.0,0.0,0.0,8.739778117728525,0.0,8.739778117728525,0.0007283148431440438,0,20.0,14.0,14.98360655737705,-6.0,none,none,-1,1.0,2.5,0.0,39.0,0.9,0.05,0.05,0.00036415742157202196,set_cost_weights,agent,Prepared for the upcoming on-peak hours and evening high temperature demand by slightly raising energy cost weight.,Prepared for the upcoming on-peak hours and evening high temperature demand by slightly raising energy cost weight.,1.0,2.5,0.0,39.0,0.9,0.05,0.05,0.00036415742157202196
2026-04-02 04:00:00,proactive,2026-04-02 03:55:00,2026-04-02 03:59:00,39.029238937698196,39.0,0.0,0.0,0.0,8.739778117728525,0.0,8.739778117728525,0.0007283148431440438,0,14.0,14.0,14.0,0.0,none,none,-1,1.0,2.5,0.0,39.0,0.9,0.05,0.05,0.00036415742157202196,set_cost_weights,agent,Raising comfort weight to prepare for evening high temperature demand and ensuring stability during sleep period.,Raising comfort weight to prepare for evening high temperature demand and ensuring stability during sleep period.,1.0,2.5,0.0,39.0,0.9,0.05,0.05,0.00036415742157202196
2026-04-02 04:10:00,proactive,2026-04-02 04:05:00,2026-04-02 04:09:00,38.15727783193275,39.0,0.712526456718716,0.712526456718716,0.8427221680672474,9.585596091221406,0.14001375890789658,9.780819854880766,0.0007987996742684505,0,14.0,14.0,14.0,0.0,none,none,-1,1.0,2.5,0.0,39.0,0.9,0.05,0.05,0.45732878325783294,set_cost_weights,agent,Raising comfort weight to prepare for evening high temperature demand and ensuring stability during sleep period.,Raising comfort weight to prepare for evening high temperature demand and ensuring stability during sleep period.,1.0,2.5,0.0,39.0,0.9,0.05,0.05,0.45732878325783294
2026-04-02 04:20:00,proactive,2026-04-02 04:15:00,2026-04-02 04:19:00,37.80389955803946,39.0,1.1528106500991513,1.1528106500991513,1.1961004419605388,10.438921063676732,0.10176799188823511,10.580226150682256,0.0008699100886397276,0,14.0,14.0,14.0,0.0,none,none,-1,1.0,2.5,0.0,39.0,0.9,0.05,0.05,1.1965126606602898,set_cost_weights,agent,"Increased outdoor temperature and upcoming on-peak hours suggest raising energy cost weight to manage costs, while slightly reducing comfort weight to balance user objective.","Increased outdoor temperature and upcoming on-peak hours suggest raising energy cost weight to manage costs, while slightly reducing comfort weight to balance user objective.",1.0,2.5,0.0,39.0,0.9,0.05,0.05,1.1965126606602898
2026-04-02 04:30:00,proactive,2026-04-02 04:25:00,2026-04-02 04:29:00,37.76925181301997,39.0,1.23983689963178,1.23983689963178,1.244978604270095,11.035470367068594,0.06796829877732487,11.129403856490068,0.0009196225305890496,0,14.0,14.0,14.0,0.0,none,none,-1,1.0,2.5,0.0,39.0,0.9,0.05,0.05,1.3839369326893582,set_cost_weights,agent,"Evening temperature rise and on-peak tariff suggest raising comfort weight to prepare for higher demand, while slightly lowering energy weight due to upcoming high prices.","Evening temperature rise and on-peak tariff suggest raising comfort weight to prepare for higher demand, while slightly lowering energy weight due to upcoming high prices.",1.0,2.5,0.0,39.0,0.9,0.05,0.05,1.3839369326893582
2026-04-02 04:40:00,proactive,2026-04-02 04:35:00,2026-04-02 04:39:00,37.91057238226602,39.0,1.1255127608221271,1.1255127608221271,1.1597966174997367,11.416350682204179,0.040953338810920406,11.472591523331182,0.0009513625568503481,0,14.0,14.0,14.0,0.0,none,none,-1,1.0,2.5,0.0,39.0,0.9,0.05,0.05,1.1405771715449085,set_cost_weights,agent,Raising comfort weight to prepare for evening high temperature demand and improving stability during sleep.,Raising comfort weight to prepare for evening high temperature demand and improving stability during sleep.,1.0,2.5,0.0,39.0,0.9,0.05,0.05,1.1405771715449085
2026-04-02 04:50:00,proactive,2026-04-02 04:45:00,2026-04-02 04:49:00,38.128189987622655,39.0,0.9177282611909163,0.9177282611909163,0.9632336543166176,11.631706271188715,0.021100157032306128,11.660360274421535,0.0009693088559323929,0,14.0,14.0,14.0,0.0,none,none,-1,1.0,2.5,0.0,39.0,0.9,0.05,0.05,0.7584874093031347,set_cost_weights,agent,"Prepared for evening temperature rise and on-peak tariff, slightly raising comfort weight.","Prepared for evening temperature rise and on-peak tariff, slightly raising comfort weight.",1.0,2.5,0.0,39.0,0.9,0.05,0.05,0.7584874093031347
2026-04-02 05:00:00,proactive,2026-04-02 04:55:00,2026-04-02 04:59:00,38.35856890056506,39.0,0.6866712198537627,0.6866712198537627,0.7322990673041261,11.730026052223677,0.007684030726889298,11.740115215899943,0.0009775021710186399,0,14.0,20.18,14.101311475409835,6.18,none,none,-1,1.0,2.5,0.0,39.0,0.9,0.05,0.05,0.42485439338188025,set_cost_weights,agent,Raising comfort weight to prepare for evening high temperature demand and ensuring stability during sleep period.,Raising comfort weight to prepare for evening high temperature demand and ensuring stability during sleep period.,1.0,2.5,0.0,39.0,0.9,0.05,0.05,0.42485439338188025
2026-04-02 05:10:00,proactive,2026-04-02 05:05:00,2026-04-02 05:09:00,38.56587068243414,39.0,0.4731247928373975,0.4731247928373975,0.5128882861489004,11.752606348056776,0.0006615812828454833,11.751397035050847,0.0009793838623380646,0,14.0,20.18,15.114426229508194,6.18,none,none,-1,1.0,2.5,0.0,39.0,0.9,0.05,0.05,0.2019520546766285,set_cost_weights,agent,Raising comfort weight to prepare for evening high temperature demand and ensuring stability during sleep period.,Raising comfort weight to prepare for evening high temperature demand and ensuring stability during sleep period.,1.0,2.5,0.0,39.0,0.9,0.05,0.05,0.2019520546766285
2026-04-02 05:20:00,proactive,2026-04-02 05:15:00,2026-04-02 05:19:00,38.73381491089217,39.0,0.2967529539873411,0.2967529539873411,0.3281936003711863,11.731506868985447,0.004905643799669513,11.724376569841349,0.0009776255724154542,0,14.0,20.18,16.127540983606554,6.18,none,none,-1,1.0,2.5,0.0,39.0,0.9,0.05,0.05,0.07974490284199894,set_cost_weights,agent,Raising comfort weight to prepare for evening high temperature demand and ensuring stability during sleep period.,Raising comfort weight to prepare for evening high temperature demand and ensuring stability during sleep period.,1.0,2.5,0.0,39.0,0.9,0.05,0.05,0.07974490284199894
2026-04-02 05:30:00,proactive,2026-04-02 05:25:00,2026-04-02 05:29:00,38.81963059435943,39.0,0.0,0.0,0.0,11.496731358933275,0.0,11.496731358933275,0.0009580609465777728,0,14.0,20.18,17.14065573770492,6.18,none,none,-1,1.0,2.5,0.0,39.0,0.9,0.05,0.05,0.0004790304732888864,set_cost_weights,agent,"Prepared for evening temperature rise and on-peak tariff, slightly raising comfort weight.","Prepared for evening temperature rise and on-peak tariff, slightly raising comfort weight.",1.0,2.5,0.0,39.0,0.9,0.05,0.05,0.0004790304732888864
2026-04-02 05:40:00,proactive,2026-04-02 05:35:00,2026-04-02 05:39:00,38.85099120715109,39.0,0.0,0.0,0.0,11.496731358933275,0.0,11.496731358933275,0.0009580609465777728,0,14.0,20.18,18.153770491803286,6.18,none,none,-1,1.0,2.5,0.0,39.0,0.9,0.05,0.05,0.0004790304732888864,set_cost_weights,agent,Raising comfort weight to prepare for evening high temperature demand and adjusting energy weight in anticipation of on-peak hours.,Raising comfort weight to prepare for evening high temperature demand and adjusting energy weight in anticipation of on-peak hours.,1.0,2.5,0.0,39.0,0.9,0.05,0.05,0.0004790304732888864
2026-04-02 05:50:00,proactive,2026-04-02 05:45:00,2026-04-02 05:49:00,38.87689457367296,39.0,0.0,0.0,0.0,11.496731358933275,0.0,11.496731358933275,0.0009580609465777728,0,14.0,20.18,19.166885245901646,6.18,none,none,-1,1.0,2.5,0.0,39.0,0.9,0.05,0.05,0.0004790304732888864,set_cost_weights,agent,Raising comfort weight to prepare for evening high temperature demand and ensuring stability during sleep period.,Raising comfort weight to prepare for evening high temperature demand and ensuring stability during sleep period.,1.0,2.5,0.0,39.0,0.9,0.05,0.05,0.0004790304732888864
2026-04-02 06:00:00,proactive,2026-04-02 05:55:00,2026-04-02 05:59:00,38.89829034172203,39.0,0.0,0.0,0.0,11.496731358933275,0.0,11.496731358933275,0.0009580609465777728,0,20.18,20.74,20.189180327868858,0.5599999999999987,none,none,-1,1.0,2.5,0.0,39.0,0.9,0.05,0.05,0.0004790304732888864,set_cost_weights,agent,Prepare for the on-peak period by raising energy cost weight and slightly reducing comfort to balance user objective.,Prepare for the on-peak period by raising energy cost weight and slightly reducing comfort to balance user objective.,1.0,2.5,0.0,39.0,0.9,0.05,0.05,0.0004790304732888864
2026-04-02 06:10:00,proactive,2026-04-02 06:05:00,2026-04-02 06:09:00,39.64631824643888,38.5,1.0409362565680453,-1.0409362565680453,1.1463182464388808,10.185900522160974,0.1413126998741688,9.989165085824801,0.0008488250435134143,0,20.18,20.74,20.280983606557378,0.5599999999999987,none,none,-1,1.0,2.5,0.0,38.5,0.9,0.05,0.05,0.9756227907636609,set_cost_weights,agent,Raising comfort weight to prepare for evening high temperature demand and improving stability during sleep period.,Raising comfort weight to prepare for evening high temperature demand and improving stability during sleep period.,1.0,2.5,0.0,38.5,0.9,0.05,0.05,0.9756227907636609
2026-04-02 06:20:00,proactive,2026-04-02 06:15:00,2026-04-02 06:19:00,39.89035575575624,38.5,1.3672182114812557,-1.3672182114812557,1.3903557557562394,9.336660512197925,0.09967053947906096,9.198490631499842,0.0007780550426831603,0,20.18,20.74,20.3727868852459,0.5599999999999987,none,none,-1,1.0,2.5,0.0,38.5,0.9,0.05,0.05,1.6827485476449755,set_cost_weights,agent,Raising comfort weight to prepare for evening high temperature demand and ensuring stability during sleep period.,Raising comfort weight to prepare for evening high temperature demand and ensuring stability during sleep period.,1.0,2.5,0.0,38.5,0.9,0.05,0.05,1.6827485476449755
