time,decision_mode,window_start,window_end,current_ti_C,current_tsp_C,mean_abs_error_C,mean_error_C,max_abs_error_C,power_mean_W,power_std_W,last_power_W,energy_kWh,error_sign_changes,Ta_now_C,Ta_future_C,Ta_mean_future_C,Ta_delta_next_1h_C,next_habit_label,next_habit_type,minutes_to_next_habit,kp_before,ki_before,kd_before,setpoint_before_C,comfort_weight_before,energy_weight_before,response_weight_before,weighted_cost_before,action,decision_source,reason,rationale,kp_after,ki_after,kd_after,setpoint_after_C,comfort_weight_after,energy_weight_after,response_weight_after,weighted_cost_after
2026-04-02 19:10:00,proactive,2026-04-02 19:05:00,2026-04-02 19:09:00,38.88865406884189,39.5,0.6694354553718312,0.6694354553718312,0.7287981944925406,9.029162787088818,0.002997531518526156,9.024412524581974,0.0007524302322574015,0,20.73,19.72,20.547868852459022,-1.0100000000000016,none,none,-1,1.0,2.5,0.0,39.5,0.8333333333333333,0.11764705882352941,0.049019607843137254,0.37433840496439935,set_cost_weights,agent,"Forecast shows a drop in outdoor temperature, and the next off-peak period is at 21:10, so raising energy weight to save costs during this period.","Forecast shows a drop in outdoor temperature, and the next off-peak period is at 21:10, so raising energy weight to save costs during this period.",1.0,2.5,0.0,39.5,0.8333333333333333,0.11764705882352941,0.049019607843137254,0.37433840496439935
2026-04-02 19:20:00,proactive,2026-04-02 19:15:00,2026-04-02 19:19:00,39.13563379916484,39.5,0.4089951244292308,0.4089951244292308,0.4549869296591069,8.98565704247205,0.008622729641356948,8.973223132096736,0.0007488047535393376,0,20.73,19.72,20.382295081967214,-1.0100000000000016,none,none,-1,1.0,2.5,0.0,39.5,0.8333333333333333,0.11764705882352941,0.049019607843137254,0.14027847455649944,set_cost_weights,agent,Preparation for the upcoming off-peak period and stability preference at night.,Preparation for the upcoming off-peak period and stability preference at night.,1.0,2.5,0.0,39.5,0.8333333333333333,0.11764705882352941,0.049019607843137254,0.14027847455649944
2026-04-02 19:30:00,proactive,2026-04-02 19:25:00,2026-04-02 19:29:00,39.307306497405186,39.5,0.1390371914727325,0.1390371914727325,0.24855222040824287,8.834711306923355,0.10912156783216377,8.701188679690702,0.0007362259422436129,0,20.73,19.72,20.21672131147541,-1.0100000000000016,none,none,-1,1.0,2.5,0.0,39.5,0.8333333333333333,0.11764705882352941,0.049019607843137254,0.016978473171150373,set_cost_weights,agent,Prepare for the upcoming off-peak period by slightly raising energy weight to save costs.,Prepare for the upcoming off-peak period by slightly raising energy weight to save costs.,1.0,2.5,0.0,39.5,0.8333333333333333,0.11764705882352941,0.049019607843137254,0.016978473171150373
2026-04-02 19:40:00,proactive,2026-04-02 19:35:00,2026-04-02 19:39:00,39.36709551084515,39.5,0.0,0.0,0.0,8.701188679690702,0.0,8.701188679690702,0.000725099056640892,0,20.73,19.72,20.05114754098361,-1.0100000000000016,none,none,-1,1.0,2.5,0.0,39.5,0.8333333333333333,0.11764705882352941,0.049019607843137254,0.0008530577136951669,set_cost_weights,agent,Prepared for upcoming off-peak hours by slightly raising energy weight,Prepared for upcoming off-peak hours by slightly raising energy weight,1.0,2.5,0.0,39.5,0.8333333333333333,0.11764705882352941,0.049019607843137254,0.0008530577136951669
2026-04-02 19:50:00,proactive,2026-04-02 19:45:00,2026-04-02 19:49:00,39.41648028337513,39.5,0.0,0.0,0.0,8.701188679690702,0.0,8.701188679690702,0.000725099056640892,0,20.73,19.72,19.885573770491806,-1.0100000000000016,none,none,-1,1.0,2.5,0.0,39.5,0.8333333333333333,0.11764705882352941,0.049019607843137254,0.0008530577136951669,set_cost_weights,agent,Prepared for the upcoming off-peak period by slightly raising energy weight to save costs.,Prepared for the upcoming off-peak period by slightly raising energy weight to save costs.,1.0,2.5,0.0,39.5,0.8333333333333333,0.11764705882352941,0.049019607843137254,0.0008530577136951669
2026-04-02 20:00:00,proactive,2026-04-02 19:55:00,2026-04-02 19:59:00,39.45727131867608,39.5,0.0,0.0,0.0,8.701188679690702,0.0,8.701188679690702,0.000725099056640892,0,19.72,23.02,19.77409836065574,3.3000000000000007,none,none,-1,1.0,2.5,0.0,39.5,0.8333333333333333,0.11764705882352941,0.049019607843137254,0.0008530577136951669,set_cost_weights,agent,Prepared for upcoming off-peak hours by slightly raising energy cost weight,Prepared for upcoming off-peak hours by slightly raising energy cost weight,1.0,2.5,0.0,39.5,0.85,0.1,0.05,0.000725099056640892
2026-04-02 20:10:00,proactive,2026-04-02 20:05:00,2026-04-02 20:09:00,39.31520797240578,39.5,0.0,0.0,0.0,8.701188679690702,0.0,8.701188679690702,0.000725099056640892,0,19.72,23.02,20.31508196721311,3.3000000000000007,none,none,-1,1.0,2.5,0.0,39.5,0.85,0.1,0.05,0.000725099056640892,set_cost_weights,agent,Preparation for the upcoming off-peak period and user preference for stability,Preparation for the upcoming off-peak period and user preference for stability,1.0,2.5,0.0,39.5,0.8571428571428571,0.09523809523809523,0.047619047619047616,0.0006905705301341828
2026-04-02 20:20:00,proactive,2026-04-02 20:15:00,2026-04-02 20:19:00,39.27787416094301,39.5,0.22145891505179235,0.22145891505179235,0.2222055083994121,8.986026433131146,0.013847772635162504,9.005193585362354,0.000748835536094262,0,19.72,23.02,20.85606557377049,3.3000000000000007,none,none,-1,1.0,2.5,0.0,39.5,0.8571428571428571,0.09523809523809523,0.047619047619047616,0.04275097971772199,set_cost_weights,agent,Prepare for the upcoming off-peak period by slightly raising energy weight to save costs,Prepare for the upcoming off-peak period by slightly raising energy weight to save costs,1.0,2.5,0.0,39.5,0.8214063472308649,0.13067828251400124,0.047915370255133795,0.04126370549724873
2026-04-02 20:30:00,proactive,2026-04-02 20:25:00,2026-04-02 20:29:00,39.29576644927274,39.5,0.20959615484705552,0.20959615484705552,0.21453643511078013,9.064789268945912,0.008638099409146264,9.076678220499579,0.0007553991057454928,0,19.72,23.02,21.397049180327866,3.3000000000000007,none,none,-1,1.0,2.5,0.0,39.5,0.8214063472308649,0.13067828251400124,0.047915370255133795,0.03707199125293672,set_cost_weights,agent,Prepared for upcoming off-peak hours and stability preference,Prepared for upcoming off-peak hours and stability preference,1.0,2.5,0.0,39.5,0.8173076923076923,0.13461538461538464,0.04807692307692308,0.03692167598900955
2026-04-02 20:40:00,proactive,2026-04-02 20:35:00,2026-04-02 20:39:00,39.300777983588866,39.5,0.08080877981736308,0.08080877981736308,0.20400612908552063,8.99033775621541,0.09979042859354997,8.914629129625187,0.0007491948130179511,0,19.72,23.02,21.93803278688524,3.3000000000000007,none,none,-1,1.0,2.5,0.0,39.5,0.8173076923076923,0.13461538461538464,0.04807692307692308,0.006347956524835569,set_cost_weights,agent,Preparation for upcoming off-peak hours and stability preference,Preparation for upcoming off-peak hours and stability preference,1.0,2.5,0.0,39.5,0.8173076923076923,0.13461538461538464,0.04807692307692308,0.006347956524835569
2026-04-02 20:50:00,proactive,2026-04-02 20:45:00,2026-04-02 20:49:00,39.30431816932278,39.5,0.08074838509082269,0.08074838509082269,0.20202758324665382,9.023997858729027,0.09966254890313485,8.94829233219339,0.0007519998215607522,0,19.72,23.02,22.47901639344262,3.3000000000000007,none,none,-1,1.0,2.5,0.0,39.5,0.8173076923076923,0.13461538461538464,0.04807692307692308,0.006343751823830974,set_cost_weights,agent,"Forecast suggests increasing outdoor temperature, raising energy weight to prepare for higher heating demand and align with user's cost-saving objective.","Forecast suggests increasing outdoor temperature, raising energy weight to prepare for higher heating demand and align with user's cost-saving objective.",1.0,2.5,0.0,39.5,0.8173076923076923,0.13461538461538464,0.04807692307692308,0.006343751823830974
2026-04-02 21:00:00,proactive,2026-04-02 20:55:00,2026-04-02 20:59:00,39.3012898351893,39.5,0.040043610841657085,0.040043610841657085,0.20021805420828542,9.005028872407976,0.08008722168331416,8.96498526156632,0.0007504190727006646,0,23.02,22.1,23.004918032786886,-0.9199999999999982,sleep_stability_preference,stability,60,1.0,2.5,0.0,39.5,0.8173076923076923,0.13461538461538464,0.04807692307692308,0.0023222434262063297,set_cost_weights,agent,Prepared for the upcoming stability preference by slightly raising comfort weight and lowering energy weight to balance cost.,Prepared for the upcoming stability preference by slightly raising comfort weight and lowering energy weight to balance cost.,1.0,2.5,0.0,39.5,0.8173076923076923,0.13461538461538464,0.04807692307692308,0.0023222434262063297
2026-04-02 21:10:00,proactive,2026-04-02 21:05:00,2026-04-02 21:09:00,39.82804152908312,39.5,0.2139421620438327,-0.2139421620438327,0.3280415290831229,8.730483270835185,0.128860945710602,8.592372448724065,0.0007275402725695988,0,23.02,22.1,22.85409836065573,-0.9199999999999982,sleep_stability_preference,stability,50,1.0,2.5,0.0,39.5,0.8173076923076923,0.13461538461538464,0.04807692307692308,0.03839250620628828,set_cost_weights,agent,Prepared for upcoming stability preference by slightly raising comfort weight,Prepared for upcoming stability preference by slightly raising comfort weight,1.0,2.5,0.0,39.5,0.8173076923076923,0.13461538461538464,0.04807692307692308,0.03839250620628828
2026-04-02 21:20:00,proactive,2026-04-02 21:15:00,2026-04-02 21:19:00,40.07186634797327,39.5,0.5389625795920807,-0.5389625795920807,0.5718663479732697,8.227220209036016,0.05702007759935567,8.147947802353144,0.0006856016840863347,0,23.02,22.1,22.70327868852458,-0.9199999999999982,sleep_stability_preference,stability,40,1.0,2.5,0.0,39.5,0.8173076923076923,0.13461538461538464,0.04807692307692308,0.23833577479987436,set_cost_weights,agent,Prepared for the upcoming stability preference by slightly raising comfort weight to ensure better temperature consistency during sleep.,Prepared for the upcoming stability preference by slightly raising comfort weight to ensure better temperature consistency during sleep.,1.0,2.5,0.0,39.5,0.8173076923076923,0.13461538461538464,0.04807692307692308,0.23833577479987436
2026-04-02 21:30:00,proactive,2026-04-02 21:25:00,2026-04-02 21:29:00,40.128709824664426,39.5,0.6269708653071518,-0.6269708653071518,0.6290052640128252,7.888986331631061,0.039093142556845525,7.834877911661893,0.0006574155276359217,0,23.02,22.1,22.55245901639343,-0.9199999999999982,sleep_stability_preference,stability,30,1.0,2.5,0.0,39.5,0.8173076923076923,0.13461538461538464,0.04807692307692308,0.3221628404782196,set_cost_weights,agent,Prepared for the upcoming stability preference by slightly raising comfort weight to ensure better temperature consistency during sleep.,Prepared for the upcoming stability preference by slightly raising comfort weight to ensure better temperature consistency during sleep.,1.0,2.5,0.0,39.5,0.8333333333333333,0.11764705882352941,0.049019607843137254,0.3283508539135502
2026-04-02 21:40:00,proactive,2026-04-02 21:35:00,2026-04-02 21:39:00,40.077576377628354,39.5,0.5928289374684809,-0.5928289374684809,0.6068924095273047,7.6667002240954165,0.024369098063222794,7.633161538560461,0.0006388916853412845,0,23.02,22.1,22.40163934426229,-0.9199999999999982,sleep_stability_preference,stability,20,1.0,2.5,0.0,39.5,0.8333333333333333,0.11764705882352941,0.049019607843137254,0.29362357155058205,set_cost_weights,agent,Prepared for upcoming stability preference by slightly raising comfort weight,Prepared for upcoming stability preference by slightly raising comfort weight,1.0,2.5,0.0,39.5,0.85,0.1,0.05,0.29936826464452543
2026-04-02 21:50:00,proactive,2026-04-02 21:45:00,2026-04-02 21:49:00,39.975001154181086,39.5,0.49741215093930863,-0.49741215093930863,0.5194408265256598,7.535680123283777,0.01328198412551043,7.517566196659971,0.0006279733436069814,0,23.02,22.1,22.250819672131136,-0.9199999999999982,sleep_stability_preference,stability,10,1.0,2.5,0.0,39.5,0.85,0.1,0.05,0.21093403749800285,set_cost_weights,agent,Prepared for the upcoming stability preference by raising comfort weight to ensure better temperature tracking during sleep.,Prepared for the upcoming stability preference by raising comfort weight to ensure better temperature tracking during sleep.,1.0,2.5,0.0,39.5,0.8571428571428571,0.09523809523809523,0.047619047619047616,0.21267140942200602
2026-04-02 22:00:00,proactive,2026-04-02 21:55:00,2026-04-02 21:59:00,39.85808382327219,39.5,0.3814330459178592,-0.3814330459178592,0.40488364790789433,7.470786358911373,0.005593530454840012,7.463324637129853,0.0006225655299092811,0,22.1,21.33,22.08737704918032,-0.7700000000000031,sleep_stability_preference,stability,0,1.0,2.5,0.0,39.5,0.8571428571428571,0.09523809523809523,0.047619047619047616,0.1252996427620921,set_cost_weights,agent,Prepared for overnight stability preference with slightly higher comfort weight,Prepared for overnight stability preference with slightly higher comfort weight,1.0,2.5,0.0,39.5,0.9,0.05,0.05,0.13125334213524212
2026-04-02 22:10:00,reactive,2026-04-02 22:05:00,2026-04-02 22:09:00,39.44293603870703,39.0,0.5194940783681957,-0.5194940783681957,0.5990552569208134,7.080827554088136,0.025762540541555926,7.117346703868612,0.000590068962840678,0,22.1,21.33,21.9611475409836,-0.7700000000000031,none,none,-1,1.0,2.5,0.0,39.0,0.9,0.05,0.05,0.24318188561976264,set_cost_weights,agent,Recent tracking error indicates a small adjustment is needed to improve comfort while maintaining cost balance.,Recent tracking error indicates a small adjustment is needed to improve comfort while maintaining cost balance.,1.0,2.5,0.0,39.0,0.85,0.1,0.05,0.22998321522820192
2026-04-02 22:20:00,reactive,2026-04-02 22:15:00,2026-04-02 22:19:00,39.16640005125645,39.0,0.09524641317699149,-0.09524641317699149,0.251722917868193,7.375701977534639,0.1145005335917271,7.469077481144825,0.0006146418314612199,0,22.1,21.33,21.834918032786874,-0.7700000000000031,none,none,-1,1.0,2.5,0.0,39.0,0.85,0.1,0.05,0.008328967332901395,set_cost_weights,agent,"Recent telemetry shows a small tracking error, but the upcoming outdoor temperature drop suggests raising energy weight to prepare for increased heating demand.","Recent telemetry shows a small tracking error, but the upcoming outdoor temperature drop suggests raising energy weight to prepare for increased heating demand.",1.0,2.5,0.0,39.0,0.85,0.1,0.05,0.008328967332901395
2026-04-02 22:30:00,reactive,2026-04-02 22:25:00,2026-04-02 22:29:00,39.02287905689231,39.0,0.0,0.0,0.0,7.469077481144825,0.0,7.469077481144825,0.0006224231234287354,0,22.1,21.33,21.70868852459016,-0.7700000000000031,none,none,-1,1.0,2.5,0.0,39.0,0.85,0.1,0.05,0.0006224231234287355,set_cost_weights,agent,"Recent telemetry shows no error, suggesting the current settings are effective for now.","Recent telemetry shows no error, suggesting the current settings are effective for now.",1.0,2.5,0.0,39.0,0.85,0.1,0.05,0.0006224231234287355
2026-04-02 22:40:00,reactive,2026-04-02 22:35:00,2026-04-02 22:39:00,38.904333002154885,39.0,0.0,0.0,0.0,7.469077481144825,0.0,7.469077481144825,0.0006224231234287354,0,22.1,21.33,21.582459016393436,-0.7700000000000031,none,none,-1,1.0,2.5,0.0,39.0,0.85,0.1,0.05,0.0006224231234287355,set_cost_weights,agent,"Recent telemetry shows perfect tracking, no adjustments needed for gains or setpoint. The upcoming off-peak hours suggest maintaining current cost weights to balance comfort and energy savings.","Recent telemetry shows perfect tracking, no adjustments needed for gains or setpoint. The upcoming off-peak hours suggest maintaining current cost weights to balance comfort and energy savings.",1.0,2.5,0.0,39.0,0.85,0.1,0.05,0.0006224231234287355
2026-04-02 22:50:00,reactive,2026-04-02 22:45:00,2026-04-02 22:49:00,38.80641584964303,39.0,0.0,0.0,0.0,7.469077481144825,0.0,7.469077481144825,0.0006224231234287354,0,22.1,21.33,21.456229508196714,-0.7700000000000031,none,none,-1,1.0,2.5,0.0,39.0,0.85,0.1,0.05,0.0006224231234287355,set_cost_weights,agent,"Recent telemetry shows perfect tracking, no adjustments needed for comfort or energy cost balance.","Recent telemetry shows perfect tracking, no adjustments needed for comfort or energy cost balance.",1.0,2.5,0.0,39.0,0.85,0.1,0.05,0.0006224231234287355
2026-04-02 23:00:00,reactive,2026-04-02 22:55:00,2026-04-02 22:59:00,38.800761265700764,39.0,0.12229211366855566,0.12229211366855566,0.2058897032687952,7.648696406875628,0.10235645158319473,7.5365601717968165,0.0006373913672396357,0,21.33,21.33,21.329999999999995,0.0,none,none,-1,1.0,2.5,0.0,39.0,0.85,0.1,0.05,0.01335202798193523,set_cost_weights,agent,"Recent telemetry shows minimal error and stable conditions, suggesting no immediate need for comfort or energy adjustments.","Recent telemetry shows minimal error and stable conditions, suggesting no immediate need for comfort or energy adjustments.",1.0,2.5,0.0,39.0,0.85,0.1,0.05,0.01335202798193523
2026-04-02 23:10:00,reactive,2026-04-02 23:05:00,2026-04-02 23:09:00,38.717754083050906,39.0,0.27351581586353146,0.27351581586353146,0.28224591694909407,7.893676179175256,0.02299681622011736,7.92559514337572,0.0006578063482646047,0,21.33,21.33,21.329999999999995,0.0,none,none,-1,1.0,2.5,0.0,39.0,0.85,0.1,0.05,0.06424720286603831,set_cost_weights,agent,"Recent telemetry shows a small tracking error, but the current cost weights balance comfort and energy well for off-peak hours.","Recent telemetry shows a small tracking error, but the current cost weights balance comfort and energy well for off-peak hours.",1.0,2.5,0.0,39.0,0.85,0.1,0.05,0.06424720286603831
2026-04-02 23:20:00,reactive,2026-04-02 23:15:00,2026-04-02 23:19:00,38.71447849245326,39.0,0.28840641973097975,0.28840641973097975,0.2904225297531653,8.027994667721321,0.01523601899313607,8.04904127661327,0.0006689995556434433,0,21.33,21.33,21.33,0.0,none,none,-1,1.0,2.5,0.0,39.0,0.85,0.1,0.05,0.07137058021520337,set_cost_weights,agent,"Recent telemetry shows small tracking error, but the upcoming on-peak period suggests raising energy cost weight to save costs.","Recent telemetry shows small tracking error, but the upcoming on-peak period suggests raising energy cost weight to save costs.",1.0,2.5,0.0,39.0,0.85,0.1,0.05,0.07137058021520337
2026-04-02 23:30:00,reactive,2026-04-02 23:25:00,2026-04-02 23:29:00,38.74982544350626,39.0,0.25893296287834316,0.25893296287834316,0.26730620656779536,8.11298283306899,0.009081212410933065,8.125445101496277,0.0006760819027557492,0,21.33,21.33,21.330000000000005,0.0,none,none,-1,1.0,2.5,0.0,39.0,0.85,0.1,0.05,0.05766543958413611,set_cost_weights,agent,"Recent telemetry shows a small tracking error, but the current tariff is off-peak and unlikely to change in the next hour. The user's objective is balanced comfort and cost, so no significant adjustment is needed.","Recent telemetry shows a small tracking error, but the current tariff is off-peak and unlikely to change in the next hour. The user's objective is balanced comfort and cost, so no significant adjustment is needed.",1.0,2.5,0.0,39.0,0.85,0.1,0.05,0.05766543958413611
2026-04-02 23:40:00,reactive,2026-04-02 23:35:00,2026-04-02 23:39:00,38.80135585792825,39.0,0.16969511535637166,0.16969511535637166,0.220128822224666,8.119003051959503,0.07972758521329157,7.959690764418488,0.0006765835876632919,0,21.33,21.33,21.329999999999995,0.0,none,none,-1,1.0,2.5,0.0,39.0,0.85,0.1,0.05,0.02515511609262086,set_cost_weights,agent,"Recent telemetry shows minimal error and stable conditions, but the upcoming on-peak period suggests raising energy cost weight to prepare for higher tariffs.","Recent telemetry shows minimal error and stable conditions, but the upcoming on-peak period suggests raising energy cost weight to prepare for higher tariffs.",1.0,2.5,0.0,39.0,0.85,0.1,0.05,0.02515511609262086
2026-04-02 23:50:00,reactive,2026-04-02 23:45:00,2026-04-02 23:49:00,38.801516642260424,39.0,0.04010102667974565,0.04010102667974565,0.20050513339872822,8.0232815007568,0.0811020614168644,7.984851350188711,0.0006686067917297335,0,21.33,21.33,21.329999999999995,0.0,none,none,-1,1.0,2.5,0.0,39.0,0.85,0.1,0.05,0.0020371048675621177,set_cost_weights,agent,"Recent telemetry shows minimal error and stable conditions, but the upcoming on-peak period suggests raising energy cost weight to prepare for higher tariffs.","Recent telemetry shows minimal error and stable conditions, but the upcoming on-peak period suggests raising energy cost weight to prepare for higher tariffs.",1.0,2.5,0.0,39.0,0.85,0.1,0.05,0.0020371048675621177
